{
  "document_source": "National Paints Price List",
  "effective_date": "2024-08-01",
  "currency": "AED",
  "notes": [
    "This price list supersedes all previous issued, and the prices may change without notice.",
    "All Prices in AED and applicable with VAT.",
    "The circular dated August 02, 2024 contains a subset of these products with matching prices."
  ],
  "product_categories": [
    {
      "category_name": "Decorative Coatings",
      "subcategories": [
        {
          "subcategory_name": "Water Based (Primers & Emulsions)",
          "products": [
            {
              "product_code": "A119",
              "product_name": "National Acrylic Primer (W.B.)",
              "prices": [
                {
                  "size": "18 Ltr (Drum)",
                  "price": 80.0
                },
                {
                  "size": "3.6 Ltr (Gallon)",
                  "price": 22.0
                }
              ]
            },
            {
              "product_code": "A014",
              "product_name": "National PVA Primer Sealer - Clear",
              "prices": [
                {
                  "size": "18 Ltr (Drum)",
                  "price": 76.0
                },
                {
                  "size": "3.6 Ltr (Gallon)",
                  "price": 19.0
                }
              ]
            },
            {
              "product_code": "A015",
              "product_name": "National PVA Primer White for Masonry",
              "variants": [
                {
                  "variant_name": "White",
                  "prices": [
                    {
                      "size": "18 Ltr (Drum)",
                      "price": 60.0
                    },
                    {
                      "size": "3.6 Ltr (Gallon)",
                      "price": 16.0
                    }
                  ]
                },
                {
                  "variant_name": "APS",
                  "prices": [
                    {
                      "size": "18 Ltr (Drum)",
                      "price": 80.0
                    },
                    {
                      "size": "3.6 Ltr (Gallon)",
                      "price": 23.0
                    }
                  ]
                }
              ]
            },
            {
              "product_code": "A118",
              "product_name": "National Penetrating Sealer",
              "prices": [
                {
                  "size": "18 Ltr (Drum)",
                  "price": 100.0
                },
                {
                  "size": "3.6 Ltr (Gallon)",
                  "price": 24.0
                }
              ]
            },
            {
              "product_code": "A017",
              "product_name": "National Stucco Filler",
              "prices": [
                {
                  "size": "18 Ltr (Drum)",
                  "price": 62.0
                },
                {
                  "size": "3.6 Ltr (Gallon)",
                  "price": 17.0
                },
                {
                  "size": "25 kg (Plastic Pail)",
                  "price": 56.0
                }
              ]
            },
            {
              "product_code": "PA0170080025K",
              "product_name": "National Stucco Filler - Plastic Bag (Projects Only)",
              "prices": [
                {
                  "size": "25 kg",
                  "price": 48.0
                }
              ]
            },
            {
              "product_code": "A164",
              "product_name": "National Block Filler",
              "prices": [
                {
                  "size": "18 Ltr (Drum)",
                  "price": 135.0
                },
                {
                  "size": "3.6 Ltr (Gallon)",
                  "price": 32.0
                }
              ]
            },
            {
              "product_code": "A163",
              "product_name": "National Joint Filler",
              "prices": [
                {
                  "size": "18 Ltr (Drum)",
                  "price": 160.0
                },
                {
                  "size": "3.6 Ltr (Gallon)",
                  "price": 37.0
                }
              ]
            },
            {
              "product_code": "A163CR",
              "product_name": "National Crack Filler",
              "prices": [
                {
                  "size": "18 Ltr (Drum)",
                  "price": 155.0
                },
                {
                  "size": "3.6 Ltr (Gallon)",
                  "price": 36.0
                }
              ]
            },
            {
              "product_code": "A001",
              "product_name": "National Plastic Emulsion",
              "variants": [
                {
                  "variant_name": "Metal Drum (White / Off-White)",
                  "prices": [
                    {
                      "size": "18 Ltr (Drum)",
                      "price": 58.0
                    },
                    {
                      "size": "3.6 Ltr (Gallon)",
                      "price": 16.0
                    }
                  ]
                },
                {
                  "variant_name": "Metal Drum (Standard Colors)",
                  "prices": [
                    {
                      "size": "18 Ltr (Drum)",
                      "price": 63.0
                    },
                    {
                      "size": "3.6 Ltr (Gallon)",
                      "price": 18.0
                    }
                  ]
                },
                {
                  "variant_name": "Plastic Pail (White/Off-White)",
                  "prices": [
                    {
                      "size": "20 kg",
                      "price": 54.0
                    }
                  ]
                }
              ]
            },
            {
              "product_code": "A179",
              "product_name": "National Nice Emulsion",
              "prices": [
                {
                  "size": "18 Ltr (Drum)",
                  "price": 120.0
                },
                {
                  "size": "3.6 Ltr (Gallon)",
                  "price": 29.0
                }
              ]
            },
            {
              "product_code": "A002",
              "product_name": "National Matt Emulsion",
              "variants": [
                {
                  "variant_name": "Standard (White / Off-White)",
                  "prices": [
                    {
                      "size": "18 Ltr (Drum)",
                      "price": 135.0
                    },
                    {
                      "size": "3.6 Ltr (Gallon)",
                      "price": 33.0
                    }
                  ]
                },
                {
                  "variant_name": "Standard (Standard Colors)",
                  "prices": [
                    {
                      "size": "18 Ltr (Drum)",
                      "price": 140.0
                    },
                    {
                      "size": "3.6 Ltr (Gallon)",
                      "price": 35.0
                    }
                  ]
                }
              ]
            },
            {
              "product_code": "A403",
              "product_name": "National Matt Emulsion Silk",
              "prices": [
                {
                  "size": "18 Ltr (Drum)",
                  "price": 180.0
                },
                {
                  "size": "3.6 Ltr (Gallon)",
                  "price": 40.0
                }
              ]
            },
            {
              "product_code": "A160",
              "product_name": "National Super Matt Emulsion",
              "prices": [
                {
                  "size": "18 Ltr (Drum)",
                  "price": 220.0
                },
                {
                  "size": "3.6 Ltr (Gallon)",
                  "price": 50.0
                }
              ]
            },
            {
              "product_code": "A162",
              "product_name": "National Super Acrylic Emulsion",
              "prices": [
                {
                  "size": "18 Ltr (Drum)",
                  "price": 165.0
                },
                {
                  "size": "3.6 Ltr (Gallon)",
                  "price": 38.0
                }
              ]
            },
            {
              "product_code": "A155",
              "product_name": "National Eggshell Emulsion Matt",
              "prices": [
                {
                  "size": "18 Ltr (Drum)",
                  "price": 175.0
                },
                {
                  "size": "3.6 Ltr (Gallon)",
                  "price": 40.0
                }
              ]
            },
            {
              "product_code": "A003",
              "product_name": "National Eggshell Emulsion Silk",
              "prices": [
                {
                  "size": "18 Ltr (Drum)",
                  "price": 195.0
                },
                {
                  "size": "3.6 Ltr (Gallon)",
                  "price": 46.0
                }
              ]
            },
            {
              "product_code": "A226",
              "product_name": "National Eggshell Emulsion",
              "variants": [
                {
                  "variant_name": "Semi-gloss",
                  "prices": [
                    {
                      "size": "18 Ltr (Drum)",
                      "price": 240.0
                    },
                    {
                      "size": "3.6 Ltr (Gallon)",
                      "price": 53.0
                    }
                  ]
                },
                {
                  "variant_name": "Semi-Gloss - Base WO",